🔄 INVENTORY V4 - ALIAS BULK SYNC
================================================================================

📋 Catalog IDs to sync: 149
⚙️  Skip already-synced: Yes
💾 Save results: Yes
🌍 Regions: UK 🇬🇧 → EU 🇪🇺 → US 🇺🇸

================================================================================

[K[░░░░░░░░░░░░░░░░░░░░░░░░░░░░░░░░░░░░░░░░░░░░░░░░░░] 0% | 0/149 | ✅ 0 ⏭️  0 ❌ 0 | ETA: 24m 50s[K[░░░░░░░░░░░░░░░░░░░░░░░░░░░░░░░░░░░░░░░░░░░░░░░░░░] 0% | 1/149 | ✅ 1 ⏭️  0 ❌ 0 | ETA: 74m 15s[K[░░░░░░░░░░░░░░░░░░░░░░░░░░░░░░░░░░░░░░░░░░░░░░░░░░] 1% | 2/149 | ✅ 2 ⏭️  0 ❌ 0 | ETA: 75m 6s[K[█░░░░░░░░░░░░░░░░░░░░░░░░░░░░░░░░░░░░░░░░░░░░░░░░░] 2% | 3/149 | ✅ 3 ⏭️  0 ❌ 0 | ETA: 77m 45s[K[█░░░░░░░░░░░░░░░░░░░░░░░░░░░░░░░░░░░░░░░░░░░░░░░░░] 2% | 4/149 | ✅ 4 ⏭️  0 ❌ 0 | ETA: 76m 6s[K[█░░░░░░░░░░░░░░░░░░░░░░░░░░░░░░░░░░░░░░░░░░░░░░░░░] 3% | 5/149 | ✅ 5 ⏭️  0 ❌ 0 | ETA: 74m 47s[K[██░░░░░░░░░░░░░░░░░░░░░░░░░░░░░░░░░░░░░░░░░░░░░░░░] 4% | 6/149 | ✅ 6 ⏭️  0 ❌ 0 | ETA: 75m 1s[K[██░░░░░░░░░░░░░░░░░░░░░░░░░░░░░░░░░░░░░░░░░░░░░░░░] 4% | 7/149 | ✅ 7 ⏭️  0 ❌ 0 | ETA: 74m 13s[K[██░░░░░░░░░░░░░░░░░░░░░░░░░░░░░░░░░░░░░░░░░░░░░░░░] 5% | 8/149 | ✅ 8 ⏭️  0 ❌ 0 | ETA: 73m 24s[K[███░░░░░░░░░░░░░░░░░░░░░░░░░░░░░░░░░░░░░░░░░░░░░░░] 6% | 9/149 | ✅ 9 ⏭️  0 ❌ 0 | ETA: 72m 49s[K[███░░░░░░░░░░░░░░░░░░░░░░░░░░░░░░░░░░░░░░░░░░░░░░░] 6% | 10/149 | ✅ 10 ⏭️  0 ❌ 0 | ETA: 72m 37s[K[███░░░░░░░░░░░░░░░░░░░░░░░░░░░░░░░░░░░░░░░░░░░░░░░] 7% | 11/149 | ✅ 11 ⏭️  0 ❌ 0 | ETA: 72m 24s[K[████░░░░░░░░░░░░░░░░░░░░░░░░░░░░░░░░░░░░░░░░░░░░░░] 8% | 12/149 | ✅ 12 ⏭️  0 ❌ 0 | ETA: 72m 3s[K[████░░░░░░░░░░░░░░░░░░░░░░░░░░░░░░░░░░░░░░░░░░░░░░] 8% | 13/149 | ✅ 13 ⏭️  0 ❌ 0 | ETA: 71m 54s[K[████░░░░░░░░░░░░░░░░░░░░░░░░░░░░░░░░░░░░░░░░░░░░░░] 9% | 14/149 | ✅ 14 ⏭️  0 ❌ 0 | ETA: 71m 31s[K[█████░░░░░░░░░░░░░░░░░░░░░░░░░░░░░░░░░░░░░░░░░░░░░] 10% | 15/149 | ✅ 15 ⏭️  0 ❌ 0 | ETA: 71m 4s[K[█████░░░░░░░░░░░░░░░░░░░░░░░░░░░░░░░░░░░░░░░░░░░░░] 10% | 16/149 | ✅ 16 ⏭️  0 ❌ 0 | ETA: 70m 50s[K[█████░░░░░░░░░░░░░░░░░░░░░░░░░░░░░░░░░░░░░░░░░░░░░] 11% | 17/149 | ✅ 17 ⏭️  0 ❌ 0 | ETA: 70m 11s[K[██████░░░░░░░░░░░░░░░░░░░░░░░░░░░░░░░░░░░░░░░░░░░░] 12% | 18/149 | ✅ 18 ⏭️  0 ❌ 0 | ETA: 69m 30s[K[██████░░░░░░░░░░░░░░░░░░░░░░░░░░░░░░░░░░░░░░░░░░░░] 12% | 19/149 | ✅ 19 ⏭️  0 ❌ 0 | ETA: 69m 9s[K[██████░░░░░░░░░░░░░░░░░░░░░░░░░░░░░░░░░░░░░░░░░░░░] 13% | 20/149 | ✅ 20 ⏭️  0 ❌ 0 | ETA: 68m 34s[K[███████░░░░░░░░░░░░░░░░░░░░░░░░░░░░░░░░░░░░░░░░░░░] 14% | 21/149 | ✅ 21 ⏭️  0 ❌ 0 | ETA: 67m 52s[K[███████░░░░░░░░░░░░░░░░░░░░░░░░░░░░░░░░░░░░░░░░░░░] 14% | 22/149 | ✅ 22 ⏭️  0 ❌ 0 | ETA: 67m 31s[K[███████░░░░░░░░░░░░░░░░░░░░░░░░░░░░░░░░░░░░░░░░░░░] 15% | 23/149 | ✅ 23 ⏭️  0 ❌ 0 | ETA: 66m 59s[K[████████░░░░░░░░░░░░░░░░░░░░░░░░░░░░░░░░░░░░░░░░░░] 16% | 24/149 | ✅ 24 ⏭️  0 ❌ 0 | ETA: 66m 17s[K[████████░░░░░░░░░░░░░░░░░░░░░░░░░░░░░░░░░░░░░░░░░░] 16% | 25/149 | ✅ 25 ⏭️  0 ❌ 0 | ETA: 90m 32s[K[████████░░░░░░░░░░░░░░░░░░░░░░░░░░░░░░░░░░░░░░░░░░] 17% | 26/149 | ✅ 26 ⏭️  0 ❌ 0 | ETA: 88m 53s[K[█████████░░░░░░░░░░░░░░░░░░░░░░░░░░░░░░░░░░░░░░░░░] 18% | 27/149 | ✅ 27 ⏭️  0 ❌ 0 | ETA: 87m 28s[K[█████████░░░░░░░░░░░░░░░░░░░░░░░░░░░░░░░░░░░░░░░░░] 18% | 28/149 | ✅ 28 ⏭️  0 ❌ 0 | ETA: 85m 56s[K[█████████░░░░░░░░░░░░░░░░░░░░░░░░░░░░░░░░░░░░░░░░░] 19% | 29/149 | ✅ 29 ⏭️  0 ❌ 0 | ETA: 84m 22s[K[██████████░░░░░░░░░░░░░░░░░░░░░░░░░░░░░░░░░░░░░░░░] 20% | 30/149 | ✅ 29 ⏭️  1 ❌ 0 | ETA: 80m 53s[K[██████████░░░░░░░░░░░░░░░░░░░░░░░░░░░░░░░░░░░░░░░░] 20% | 31/149 | ✅ 30 ⏭️  1 ❌ 0 | ETA: 79m 34s[K[██████████░░░░░░░░░░░░░░░░░░░░░░░░░░░░░░░░░░░░░░░░] 21% | 32/149 | ✅ 31 ⏭️  1 ❌ 0 | ETA: 78m 22s[K[███████████░░░░░░░░░░░░░░░░░░░░░░░░░░░░░░░░░░░░░░░] 22% | 33/149 | ✅ 32 ⏭️  1 ❌ 0 | ETA: 77m 10s[K[███████████░░░░░░░░░░░░░░░░░░░░░░░░░░░░░░░░░░░░░░░] 22% | 34/149 | ✅ 33 ⏭️  1 ❌ 0 | ETA: 76m 7s[K[███████████░░░░░░░░░░░░░░░░░░░░░░░░░░░░░░░░░░░░░░░] 23% | 35/149 | ✅ 34 ⏭️  1 ❌ 0 | ETA: 91m 24s[K[████████████░░░░░░░░░░░░░░░░░░░░░░░░░░░░░░░░░░░░░░] 24% | 36/149 | ✅ 35 ⏭️  1 ❌ 0 | ETA: 105m 38s[K[████████████░░░░░░░░░░░░░░░░░░░░░░░░░░░░░░░░░░░░░░] 24% | 37/149 | ✅ 36 ⏭️  1 ❌ 0 | ETA: 103m 22s[K[████████████░░░░░░░░░░░░░░░░░░░░░░░░░░░░░░░░░░░░░░] 25% | 38/149 | ✅ 37 ⏭️  1 ❌ 0 | ETA: 116m 3s[K[█████████████░░░░░░░░░░░░░░░░░░░░░░░░░░░░░░░░░░░░░] 26% | 39/149 | ✅ 38 ⏭️  1 ❌ 0 | ETA: 113m 31s[K[█████████████░░░░░░░░░░░░░░░░░░░░░░░░░░░░░░░░░░░░░] 26% | 40/149 | ✅ 39 ⏭️  1 ❌ 0 | ETA: 111m 9s[K[█████████████░░░░░░░░░░░░░░░░░░░░░░░░░░░░░░░░░░░░░] 27% | 41/149 | ✅ 40 ⏭️  1 ❌ 0 | ETA: 109m 1s[K[██████████████░░░░░░░░░░░░░░░░░░░░░░░░░░░░░░░░░░░░] 28% | 42/149 | ✅ 41 ⏭️  1 ❌ 0 | ETA: 119m 35s[K[██████████████░░░░░░░░░░░░░░░░░░░░░░░░░░░░░░░░░░░░] 28% | 43/149 | ✅ 42 ⏭️  1 ❌ 0 | ETA: 117m 0s[K[██████████████░░░░░░░░░░░░░░░░░░░░░░░░░░░░░░░░░░░░] 29% | 44/149 | ✅ 43 ⏭️  1 ❌ 0 | ETA: 114m 31s[K[███████████████░░░░░░░░░░░░░░░░░░░░░░░░░░░░░░░░░░░] 30% | 45/149 | ✅ 44 ⏭️  1 ❌ 0 | ETA: 112m 11s[K[███████████████░░░░░░░░░░░░░░░░░░░░░░░░░░░░░░░░░░░] 30% | 46/149 | ✅ 45 ⏭️  1 ❌ 0 | ETA: 109m 51s[K[███████████████░░░░░░░░░░░░░░░░░░░░░░░░░░░░░░░░░░░] 31% | 47/149 | ✅ 46 ⏭️  1 ❌ 0 | ETA: 107m 41s[K[████████████████░░░░░░░░░░░░░░░░░░░░░░░░░░░░░░░░░░] 32% | 48/149 | ✅ 47 ⏭️  1 ❌ 0 | ETA: 105m 29s[K[████████████████░░░░░░░░░░░░░░░░░░░░░░░░░░░░░░░░░░] 32% | 49/149 | ✅ 48 ⏭️  1 ❌ 0 | ETA: 103m 22s[K[████████████████░░░░░░░░░░░░░░░░░░░░░░░░░░░░░░░░░░] 33% | 50/149 | ✅ 49 ⏭️  1 ❌ 0 | ETA: 101m 20s[K[█████████████████░░░░░░░░░░░░░░░░░░░░░░░░░░░░░░░░░] 34% | 51/149 | ✅ 49 ⏭️  2 ❌ 0 | ETA: 98m 20s[K[█████████████████░░░░░░░░░░░░░░░░░░░░░░░░░░░░░░░░░] 34% | 52/149 | ✅ 50 ⏭️  2 ❌ 0 | ETA: 96m 29s[K[█████████████████░░░░░░░░░░░░░░░░░░░░░░░░░░░░░░░░░] 35% | 53/149 | ✅ 51 ⏭️  2 ❌ 0 | ETA: 94m 37s[K[██████████████████░░░░░░░░░░░░░░░░░░░░░░░░░░░░░░░░] 36% | 54/149 | ✅ 52 ⏭️  2 ❌ 0 | ETA: 92m 48s[K[██████████████████░░░░░░░░░░░░░░░░░░░░░░░░░░░░░░░░] 36% | 55/149 | ✅ 53 ⏭️  2 ❌ 0 | ETA: 91m 4s[K[██████████████████░░░░░░░░░░░░░░░░░░░░░░░░░░░░░░░░] 37% | 56/149 | ✅ 54 ⏭️  2 ❌ 0 | ETA: 89m 21s[K[███████████████████░░░░░░░░░░░░░░░░░░░░░░░░░░░░░░░] 38% | 57/149 | ✅ 55 ⏭️  2 ❌ 0 | ETA: 87m 38s[K[███████████████████░░░░░░░░░░░░░░░░░░░░░░░░░░░░░░░] 38% | 58/149 | ✅ 56 ⏭️  2 ❌ 0 | ETA: 86m 3s[K[███████████████████░░░░░░░░░░░░░░░░░░░░░░░░░░░░░░░] 39% | 59/149 | ✅ 57 ⏭️  2 ❌ 0 | ETA: 84m 26s[K[████████████████████░░░░░░░░░░░░░░░░░░░░░░░░░░░░░░] 40% | 60/149 | ✅ 58 ⏭️  2 ❌ 0 | ETA: 82m 51s[K[████████████████████░░░░░░░░░░░░░░░░░░░░░░░░░░░░░░] 40% | 61/149 | ✅ 59 ⏭️  2 ❌ 0 | ETA: 81m 20s[K[████████████████████░░░░░░░░░░░░░░░░░░░░░░░░░░░░░░] 41% | 62/149 | ✅ 60 ⏭️  2 ❌ 0 | ETA: 79m 48s[K[█████████████████████░░░░░░░░░░░░░░░░░░░░░░░░░░░░░] 42% | 63/149 | ✅ 61 ⏭️  2 ❌ 0 | ETA: 78m 17s[K[█████████████████████░░░░░░░░░░░░░░░░░░░░░░░░░░░░░] 42% | 64/149 | ✅ 62 ⏭️  2 ❌ 0 | ETA: 76m 49s[K[█████████████████████░░░░░░░░░░░░░░░░░░░░░░░░░░░░░] 43% | 65/149 | ✅ 63 ⏭️  2 ❌ 0 | ETA: 75m 24s[K[██████████████████████░░░░░░░░░░░░░░░░░░░░░░░░░░░░] 44% | 66/149 | ✅ 64 ⏭️  2 ❌ 0 | ETA: 74m 3s[K[██████████████████████░░░░░░░░░░░░░░░░░░░░░░░░░░░░] 44% | 67/149 | ✅ 65 ⏭️  2 ❌ 0 | ETA: 72m 39s[K[██████████████████████░░░░░░░░░░░░░░░░░░░░░░░░░░░░] 45% | 68/149 | ✅ 66 ⏭️  2 ❌ 0 | ETA: 71m 22s[K[███████████████████████░░░░░░░░░░░░░░░░░░░░░░░░░░░] 46% | 69/149 | ✅ 67 ⏭️  2 ❌ 0 | ETA: 70m 5s[K[███████████████████████░░░░░░░░░░░░░░░░░░░░░░░░░░░] 46% | 70/149 | ✅ 68 ⏭️  2 ❌ 0 | ETA: 68m 51s[K[███████████████████████░░░░░░░░░░░░░░░░░░░░░░░░░░░] 47% | 71/149 | ✅ 69 ⏭️  2 ❌ 0 | ETA: 67m 39s[K[████████████████████████░░░░░░░░░░░░░░░░░░░░░░░░░░] 48% | 72/149 | ✅ 70 ⏭️  2 ❌ 0 | ETA: 66m 29s[K[████████████████████████░░░░░░░░░░░░░░░░░░░░░░░░░░] 48% | 73/149 | ✅ 71 ⏭️  2 ❌ 0 | ETA: 65m 18s[K[████████████████████████░░░░░░░░░░░░░░░░░░░░░░░░░░] 49% | 74/149 | ✅ 72 ⏭️  2 ❌ 0 | ETA: 64m 8s[K[█████████████████████████░░░░░░░░░░░░░░░░░░░░░░░░░] 50% | 75/149 | ✅ 73 ⏭️  2 ❌ 0 | ETA: 62m 56s[K[█████████████████████████░░░░░░░░░░░░░░░░░░░░░░░░░] 51% | 76/149 | ✅ 74 ⏭️  2 ❌ 0 | ETA: 61m 46s[K[█████████████████████████░░░░░░░░░░░░░░░░░░░░░░░░░] 51% | 77/149 | ✅ 75 ⏭️  2 ❌ 0 | ETA: 60m 38s[K[██████████████████████████░░░░░░░░░░░░░░░░░░░░░░░░] 52% | 78/149 | ✅ 76 ⏭️  2 ❌ 0 | ETA: 64m 5s[K[██████████████████████████░░░░░░░░░░░░░░░░░░░░░░░░] 53% | 79/149 | ✅ 77 ⏭️  2 ❌ 0 | ETA: 62m 51s[K[██████████████████████████░░░░░░░░░░░░░░░░░░░░░░░░] 53% | 80/149 | ✅ 78 ⏭️  2 ❌ 0 | ETA: 61m 39s[K[███████████████████████████░░░░░░░░░░░░░░░░░░░░░░░] 54% | 81/149 | ✅ 79 ⏭️  2 ❌ 0 | ETA: 60m 29s[K[███████████████████████████░░░░░░░░░░░░░░░░░░░░░░░] 55% | 82/149 | ✅ 80 ⏭️  2 ❌ 0 | ETA: 59m 17s[K[███████████████████████████░░░░░░░░░░░░░░░░░░░░░░░] 55% | 83/149 | ✅ 81 ⏭️  2 ❌ 0 | ETA: 58m 6s[K[████████████████████████████░░░░░░░░░░░░░░░░░░░░░░] 56% | 84/149 | ✅ 82 ⏭️  2 ❌ 0 | ETA: 56m 57s[K[████████████████████████████░░░░░░░░░░░░░░░░░░░░░░] 57% | 85/149 | ✅ 83 ⏭️  2 ❌ 0 | ETA: 55m 47s[K[████████████████████████████░░░░░░░░░░░░░░░░░░░░░░] 57% | 86/149 | ✅ 84 ⏭️  2 ❌ 0 | ETA: 54m 41s[K[█████████████████████████████░░░░░░░░░░░░░░░░░░░░░] 58% | 87/149 | ✅ 85 ⏭️  2 ❌ 0 | ETA: 53m 36s[K[█████████████████████████████░░░░░░░░░░░░░░░░░░░░░] 59% | 88/149 | ✅ 86 ⏭️  2 ❌ 0 | ETA: 52m 30s[K[█████████████████████████████░░░░░░░░░░░░░░░░░░░░░] 59% | 89/149 | ✅ 87 ⏭️  2 ❌ 0 | ETA: 51m 24s[K[██████████████████████████████░░░░░░░░░░░░░░░░░░░░] 60% | 90/149 | ✅ 88 ⏭️  2 ❌ 0 | ETA: 50m 20s[K[██████████████████████████████░░░░░░░░░░░░░░░░░░░░] 61% | 91/149 | ✅ 89 ⏭️  2 ❌ 0 | ETA: 49m 15s[K[██████████████████████████████░░░░░░░░░░░░░░░░░░░░] 61% | 92/149 | ✅ 90 ⏭️  2 ❌ 0 | ETA: 48m 11s[K[███████████████████████████████░░░░░░░░░░░░░░░░░░░] 62% | 93/149 | ✅ 91 ⏭️  2 ❌ 0 | ETA: 47m 7s[K[███████████████████████████████░░░░░░░░░░░░░░░░░░░] 63% | 94/149 | ✅ 92 ⏭️  2 ❌ 0 | ETA: 46m 9s[K[███████████████████████████████░░░░░░░░░░░░░░░░░░░] 63% | 95/149 | ✅ 93 ⏭️  2 ❌ 0 | ETA: 45m 8s[K[████████████████████████████████░░░░░░░░░░░░░░░░░░] 64% | 96/149 | ✅ 94 ⏭️  2 ❌ 0 | ETA: 44m 8s[K[████████████████████████████████░░░░░░░░░░░░░░░░░░] 65% | 97/149 | ✅ 95 ⏭️  2 ❌ 0 | ETA: 43m 8s[K[████████████████████████████████░░░░░░░░░░░░░░░░░░] 65% | 98/149 | ✅ 96 ⏭️  2 ❌ 0 | ETA: 42m 8s[K[█████████████████████████████████░░░░░░░░░░░░░░░░░] 66% | 99/149 | ✅ 97 ⏭️  2 ❌ 0 | ETA: 41m 8s[K[█████████████████████████████████░░░░░░░░░░░░░░░░░] 67% | 100/149 | ✅ 98 ⏭️  2 ❌ 0 | ETA: 40m 9s[K[█████████████████████████████████░░░░░░░░░░░░░░░░░] 67% | 101/149 | ✅ 99 ⏭️  2 ❌ 0 | ETA: 39m 10s[K[██████████████████████████████████░░░░░░░░░░░░░░░░] 68% | 102/149 | ✅ 100 ⏭️  2 ❌ 0 | ETA: 38m 13s[K[██████████████████████████████████░░░░░░░░░░░░░░░░] 69% | 103/149 | ✅ 101 ⏭️  2 ❌ 0 | ETA: 37m 17s[K[██████████████████████████████████░░░░░░░░░░░░░░░░] 69% | 104/149 | ✅ 102 ⏭️  2 ❌ 0 | ETA: 36m 19s[K[███████████████████████████████████░░░░░░░░░░░░░░░] 70% | 105/149 | ✅ 103 ⏭️  2 ❌ 0 | ETA: 35m 23s[K[███████████████████████████████████░░░░░░░░░░░░░░░] 71% | 106/149 | ✅ 104 ⏭️  2 ❌ 0 | ETA: 34m 28s[K[███████████████████████████████████░░░░░░░░░░░░░░░] 71% | 107/149 | ✅ 105 ⏭️  2 ❌ 0 | ETA: 33m 33s[K[████████████████████████████████████░░░░░░░░░░░░░░] 72% | 108/149 | ✅ 106 ⏭️  2 ❌ 0 | ETA: 32m 39s[K[████████████████████████████████████░░░░░░░░░░░░░░] 73% | 109/149 | ✅ 107 ⏭️  2 ❌ 0 | ETA: 31m 45s[K[████████████████████████████████████░░░░░░░░░░░░░░] 73% | 110/149 | ✅ 108 ⏭️  2 ❌ 0 | ETA: 30m 51s[K[█████████████████████████████████████░░░░░░░░░░░░░] 74% | 111/149 | ✅ 109 ⏭️  2 ❌ 0 | ETA: 29m 57s[K[█████████████████████████████████████░░░░░░░░░░░░░] 75% | 112/149 | ✅ 110 ⏭️  2 ❌ 0 | ETA: 29m 5s[K[█████████████████████████████████████░░░░░░░░░░░░░] 75% | 113/149 | ✅ 111 ⏭️  2 ❌ 0 | ETA: 28m 13s[K[██████████████████████████████████████░░░░░░░░░░░░] 76% | 114/149 | ✅ 112 ⏭️  2 ❌ 0 | ETA: 27m 21s[K[██████████████████████████████████████░░░░░░░░░░░░] 77% | 115/149 | ✅ 113 ⏭️  2 ❌ 0 | ETA: 26m 30s[K[██████████████████████████████████████░░░░░░░░░░░░] 77% | 116/149 | ✅ 114 ⏭️  2 ❌ 0 | ETA: 25m 39s[K[███████████████████████████████████████░░░░░░░░░░░] 78% | 117/149 | ✅ 115 ⏭️  2 ❌ 0 | ETA: 24m 48s[K[███████████████████████████████████████░░░░░░░░░░░] 79% | 118/149 | ✅ 116 ⏭️  2 ❌ 0 | ETA: 23m 58s[K[███████████████████████████████████████░░░░░░░░░░░] 79% | 119/149 | ✅ 117 ⏭️  2 ❌ 0 | ETA: 23m 8s[K[████████████████████████████████████████░░░░░░░░░░] 80% | 120/149 | ✅ 118 ⏭️  2 ❌ 0 | ETA: 22m 19s[K[████████████████████████████████████████░░░░░░░░░░] 81% | 121/149 | ✅ 119 ⏭️  2 ❌ 0 | ETA: 21m 29s[K[████████████████████████████████████████░░░░░░░░░░] 81% | 122/149 | ✅ 120 ⏭️  2 ❌ 0 | ETA: 20m 40s[K[█████████████████████████████████████████░░░░░░░░░] 82% | 123/149 | ✅ 121 ⏭️  2 ❌ 0 | ETA: 19m 52s[K[█████████████████████████████████████████░░░░░░░░░] 83% | 124/149 | ✅ 122 ⏭️  2 ❌ 0 | ETA: 19m 3s[K[█████████████████████████████████████████░░░░░░░░░] 83% | 125/149 | ✅ 123 ⏭️  2 ❌ 0 | ETA: 18m 14s[K[██████████████████████████████████████████░░░░░░░░] 84% | 126/149 | ✅ 124 ⏭️  2 ❌ 0 | ETA: 17m 26s[K[██████████████████████████████████████████░░░░░░░░] 85% | 127/149 | ✅ 125 ⏭️  2 ❌ 0 | ETA: 16m 38s[K[██████████████████████████████████████████░░░░░░░░] 85% | 128/149 | ✅ 126 ⏭️  2 ❌ 0 | ETA: 15m 50s[K[███████████████████████████████████████████░░░░░░░] 86% | 129/149 | ✅ 127 ⏭️  2 ❌ 0 | ETA: 15m 2s[K[███████████████████████████████████████████░░░░░░░] 87% | 130/149 | ✅ 128 ⏭️  2 ❌ 0 | ETA: 14m 15s[K[███████████████████████████████████████████░░░░░░░] 87% | 131/149 | ✅ 129 ⏭️  2 ❌ 0 | ETA: 13m 28s[K[████████████████████████████████████████████░░░░░░] 88% | 132/149 | ✅ 130 ⏭️  2 ❌ 0 | ETA: 12m 41s[K[████████████████████████████████████████████░░░░░░] 89% | 133/149 | ✅ 131 ⏭️  2 ❌ 0 | ETA: 11m 55s[K[████████████████████████████████████████████░░░░░░] 89% | 134/149 | ✅ 132 ⏭️  2 ❌ 0 | ETA: 11m 8s[K[█████████████████████████████████████████████░░░░░] 90% | 135/149 | ✅ 133 ⏭️  2 ❌ 0 | ETA: 10m 22s[K[█████████████████████████████████████████████░░░░░] 91% | 136/149 | ✅ 134 ⏭️  2 ❌ 0 | ETA: 9m 36s[K[█████████████████████████████████████████████░░░░░] 91% | 137/149 | ✅ 135 ⏭️  2 ❌ 0 | ETA: 8m 51s[K[██████████████████████████████████████████████░░░░] 92% | 138/149 | ✅ 136 ⏭️  2 ❌ 0 | ETA: 8m 5s[K[██████████████████████████████████████████████░░░░] 93% | 139/149 | ✅ 137 ⏭️  2 ❌ 0 | ETA: 7m 21s[K[██████████████████████████████████████████████░░░░] 93% | 140/149 | ✅ 138 ⏭️  2 ❌ 0 | ETA: 6m 36s[K[███████████████████████████████████████████████░░░] 94% | 141/149 | ✅ 139 ⏭️  2 ❌ 0 | ETA: 5m 51s[K[███████████████████████████████████████████████░░░] 95% | 142/149 | ✅ 140 ⏭️  2 ❌ 0 | ETA: 5m 6s[K[███████████████████████████████████████████████░░░] 95% | 143/149 | ✅ 141 ⏭️  2 ❌ 0 | ETA: 4m 22s[K[████████████████████████████████████████████████░░] 96% | 144/149 | ✅ 142 ⏭️  2 ❌ 0 | ETA: 3m 38s[K[████████████████████████████████████████████████░░] 97% | 145/149 | ✅ 143 ⏭️  2 ❌ 0 | ETA: 2m 54s[K[████████████████████████████████████████████████░░] 97% | 146/149 | ✅ 144 ⏭️  2 ❌ 0 | ETA: 2m 10s[K[█████████████████████████████████████████████████░] 98% | 147/149 | ✅ 145 ⏭️  2 ❌ 0 | ETA: 1m 26s[K[█████████████████████████████████████████████████░] 99% | 148/149 | ✅ 146 ⏭️  2 ❌ 0 | ETA: 43s[K[██████████████████████████████████████████████████] 100% | 149/149 | ✅ 147 ⏭️  2 ❌ 0 | ETA: 0s


================================================================================
📊 BULK SYNC SUMMARY
================================================================================

📈 Overall:
  Total Catalog IDs:  149
  ✅ Synced:          147
  ⏭️  Skipped:         2 (already synced)
  ❌ Failed:          0
  ⏱️  Total Duration:  107m 27s

✅ Success Rate: 100%

📊 Data Synced:
  Products:         147
  Variants:         35498
  Market Data:      35494
  Price Snapshots:  35492

⏱️  Average Duration: 43s per product

🔍 Next Steps:

  1. Refresh materialized view:
     REFRESH MATERIALIZED VIEW CONCURRENTLY inventory_v4_alias_market_latest;

  2. Verify data in database:
     SELECT COUNT(*) FROM inventory_v4_alias_products;
     SELECT COUNT(*) FROM inventory_v4_alias_variants;
     SELECT COUNT(*) FROM inventory_v4_alias_market_data;

💾 Results saved: sync-results/bulk-sync-alias-2025-12-11T00-19-31.json

================================================================================

